{"api_url":"https://www.vasp.at/wiki/api.php","catalog_type":"vasp-wiki-page-metadata-v1","contract_name":"vasp-source-pack-input","legacy_manifest_sha256":"277bb80e0938ec3c94e214f2e367a1b7d9e97475914be8e71d0f5c56ddc06f6f","limitations":["This catalog stores pageid/revid plus separate raw-JSON and wikitext identities only; official body text is not embedded.","The 81 pages are the curated semantic source-pack subset; full public main-namespace body and link closure is recorded separately by the revision-bound legacy manifest.","The public VASP Portal, protected downloads, images, and third-party assets remain outside the Wiki main-namespace closure."],"official_root":"https://www.vasp.at/wiki/","pages":[{"api_request_url":"https://www.vasp.at/wiki/api.php?action=parse&oldid=22293&prop=text%7Cwikitext%7Crevid%7Cdisplaytitle&format=json&formatversion=2","pageid":3,"raw_json_bytes":4587,"raw_json_sha256":"0cda9d9dc5ebc4912751db20db965092989f5a701b5cad494fd03dbedd1e7fa7","revid":22293,"title":"WAVECAR","url":"https://www.vasp.at/wiki/WAVECAR","wikitext_bytes":1436,"wikitext_sha256":"2e956e02c4cf183a0deddb603b8cff89503c28645d8b864ccd6ebcb2c3f7e1b6"},{"api_request_url":"https://www.vasp.at/wiki/api.php?action=parse&oldid=37118&prop=text%7Cwikitext%7Crevid%7Cdisplaytitle&format=json&formatversion=2","pageid":4,"raw_json_bytes":22456,"raw_json_sha256":"370476a7dc2c88158993f40e81aab2844dba30385c7def9e3a178053b6dc7f21","revid":37118,"title":"CHGCAR","url":"https://www.vasp.at/wiki/CHGCAR","wikitext_bytes":6100,"wikitext_sha256":"e84acef91cfe74286bfc80ec17cb2ec88e24599586e17dd5f426bc1d0b40e8d9"},{"api_request_url":"https://www.vasp.at/wiki/api.php?action=parse&oldid=34757&prop=text%7Cwikitext%7Crevid%7Cdisplaytitle&format=json&formatversion=2","pageid":5,"raw_json_bytes":13915,"raw_json_sha256":"416779462ed47b8b73226b15cbbfca86456c42b783b279a401aaf4563f39247a","revid":34757,"title":"INCAR","url":"https://www.vasp.at/wiki/INCAR","wikitext_bytes":4571,"wikitext_sha256":"5fee2fb8f586d057201f3f688d006e09b78cc76259d5f4b2da9afe791e91008f"},{"api_request_url":"https://www.vasp.at/wiki/api.php?action=parse&oldid=33125&prop=text%7Cwikitext%7Crevid%7Cdisplaytitle&format=json&formatversion=2","pageid":8,"raw_json_bytes":18510,"raw_json_sha256":"576a25023feabae1766b438f1922d0527473bf97f6eed45f21d90ab4bff59b07","revid":33125,"title":"POTCAR","url":"https://www.vasp.at/wiki/POTCAR","wikitext_bytes":6062,"wikitext_sha256":"eed52913115397ec69356c40a41145642b43b7316e9732101554850302ab71ce"},{"api_request_url":"https://www.vasp.at/wiki/api.php?action=parse&oldid=31482&prop=text%7Cwikitext%7Crevid%7Cdisplaytitle&format=json&formatversion=2","pageid":9,"raw_json_bytes":26502,"raw_json_sha256":"4f6d216296c535870cff736ce6e83d4a85e333cf024289faba40a7694cde6b52","revid":31482,"title":"PREC","url":"https://www.vasp.at/wiki/PREC","wikitext_bytes":7628,"wikitext_sha256":"3d572dbf7046915996884314d7bc600cc243b6330556fdd58f7836a8103f8ea5"},{"api_request_url":"https://www.vasp.at/wiki/api.php?action=parse&oldid=37119&prop=text%7Cwikitext%7Crevid%7Cdisplaytitle&format=json&formatversion=2","pageid":10,"raw_json_bytes":19734,"raw_json_sha256":"fad3ef60a9a5e3f3479d9347496c022b659262d21b8b03bfdbf1ea8686b1489a","revid":37119,"title":"ICHARG","url":"https://www.vasp.at/wiki/ICHARG","wikitext_bytes":5654,"wikitext_sha256":"d00710ad6a7577d3ed1683b4e4d1c8c6d4ac10ba343535a74bee65d45ff8e19c"},{"api_request_url":"https://www.vasp.at/wiki/api.php?action=parse&oldid=36559&prop=text%7Cwikitext%7Crevid%7Cdisplaytitle&format=json&formatversion=2","pageid":11,"raw_json_bytes":35625,"raw_json_sha256":"36e2c6b392cbcac24debc0125b368627f378f7195c943cc7406bb0910d4cc314","revid":36559,"title":"The VASP Manual","url":"https://www.vasp.at/wiki/The_VASP_Manual","wikitext_bytes":13700,"wikitext_sha256":"d98a39f7f8cb0ae192a086a56e9926594e44899232af81d5bd6fb58e1b9b4e2e"},{"api_request_url":"https://www.vasp.at/wiki/api.php?action=parse&oldid=37120&prop=text%7Cwikitext%7Crevid%7Cdisplaytitle&format=json&formatversion=2","pageid":19,"raw_json_bytes":14855,"raw_json_sha256":"25d1598705c356d0b467c585ec764d340df402fed873ec1da8e228eb2b64e466","revid":37120,"title":"ISTART","url":"https://www.vasp.at/wiki/ISTART","wikitext_bytes":4734,"wikitext_sha256":"9931f57151f2de62f18964247738b771b2cbd14e495c489c4f74840c6c4b12f7"},{"api_request_url":"https://www.vasp.at/wiki/api.php?action=parse&oldid=33294&prop=text%7Cwikitext%7Crevid%7Cdisplaytitle&format=json&formatversion=2","pageid":21,"raw_json_bytes":5049,"raw_json_sha256":"7959806a182794007b3a0413507bbb811e6e64d39e48778008021ffc88956faa","revid":33294,"title":"NSW","url":"https://www.vasp.at/wiki/NSW","wikitext_bytes":1194,"wikitext_sha256":"1e3ad75372a27a36ece0329a8279567a9dd5ba051f475ebbf919ac583ee95a75"},{"api_request_url":"https://www.vasp.at/wiki/api.php?action=parse&oldid=25364&prop=text%7Cwikitext%7Crevid%7Cdisplaytitle&format=json&formatversion=2","pageid":22,"raw_json_bytes":4042,"raw_json_sha256":"35bf25efef74bbb002975adb6426e7831b90ba3437df13a1fdaf4121202f25c2","revid":25364,"title":"NELM","url":"https://www.vasp.at/wiki/NELM","wikitext_bytes":903,"wikitext_sha256":"73bf472f1b87fbf87fd2f07be40be216f1e1cbefcecfa4df9e0d668fe7a6df4e"},{"api_request_url":"https://www.vasp.at/wiki/api.php?action=parse&oldid=32792&prop=text%7Cwikitext%7Crevid%7Cdisplaytitle&format=json&formatversion=2","pageid":23,"raw_json_bytes":5486,"raw_json_sha256":"55b904f24c2c46c86a30a629c45d371131102eb16fb9460f0e93cf99dcd9a44b","revid":32792,"title":"EDIFF","url":"https://www.vasp.at/wiki/EDIFF","wikitext_bytes":1342,"wikitext_sha256":"91dc0a923339f8d72fa07383308907378b1d8273cc3650a250b0eebbafa62412"},{"api_request_url":"https://www.vasp.at/wiki/api.php?action=parse&oldid=37346&prop=text%7Cwikitext%7Crevid%7Cdisplaytitle&format=json&formatversion=2","pageid":24,"raw_json_bytes":62170,"raw_json_sha256":"1cb9101ccb901ddb54f6a8e43b0cba792461261f43af95f6d5c9899cfdca9849","revid":37346,"title":"ALGO","url":"https://www.vasp.at/wiki/ALGO","wikitext_bytes":20080,"wikitext_sha256":"26091e3cfffc45574da3c5a879f3617e30e7b35b804018e025a11cd5878a73be"},{"api_request_url":"https://www.vasp.at/wiki/api.php?action=parse&oldid=27290&prop=text%7Cwikitext%7Crevid%7Cdisplaytitle&format=json&formatversion=2","pageid":25,"raw_json_bytes":6422,"raw_json_sha256":"e807ff8fd459a2b4b972ad6b3e53693b415c3517b73873a758c980fa59fc1002","revid":27290,"title":"LMAXMIX","url":"https://www.vasp.at/wiki/LMAXMIX","wikitext_bytes":1763,"wikitext_sha256":"7f7fb90f5faceb786909b1f6a1fb4845d8036a719f233f83637eb6d050a637fc"},{"api_request_url":"https://www.vasp.at/wiki/api.php?action=parse&oldid=16120&prop=text%7Cwikitext%7Crevid%7Cdisplaytitle&format=json&formatversion=2","pageid":30,"raw_json_bytes":3416,"raw_json_sha256":"c6d0f0579851457352b4c932ca379c3787f31017efeaff488db97c1ba4c1f870","revid":16120,"title":"NELMIN","url":"https://www.vasp.at/wiki/NELMIN","wikitext_bytes":600,"wikitext_sha256":"bc70d03d9bde922385ccb6a7a9426f2f93130b93be1b6934f3b2427c246817d2"},{"api_request_url":"https://www.vasp.at/wiki/api.php?action=parse&oldid=29456&prop=text%7Cwikitext%7Crevid%7Cdisplaytitle&format=json&formatversion=2","pageid":32,"raw_json_bytes":49212,"raw_json_sha256":"4943cd292a74ce157d2d5abfa9586ce477d5756361707825e9af5e033a967014","revid":29456,"title":"IALGO","url":"https://www.vasp.at/wiki/IALGO","wikitext_bytes":15966,"wikitext_sha256":"a2268b31a17d2dd8bbe79c8e78181806f80b86e5249308da645736bc7cfcd9f7"},{"api_request_url":"https://www.vasp.at/wiki/api.php?action=parse&oldid=31110&prop=text%7Cwikitext%7Crevid%7Cdisplaytitle&format=json&formatversion=2","pageid":34,"raw_json_bytes":15590,"raw_json_sha256":"d8e53a348ca86ef3c4fc0f42f3f4a34ab7f53effefde7395d09f1ff825593d1f","revid":31110,"title":"NBANDS","url":"https://www.vasp.at/wiki/NBANDS","wikitext_bytes":3632,"wikitext_sha256":"85a8f426ef0e834c5b2d7cb8962c4d27524b95e7de9b20fd3f3b0d1fe6141234"},{"api_request_url":"https://www.vasp.at/wiki/api.php?action=parse&oldid=32552&prop=text%7Cwikitext%7Crevid%7Cdisplaytitle&format=json&formatversion=2","pageid":36,"raw_json_bytes":10042,"raw_json_sha256":"3b90edb27fb0579642748401f4748bf03d921b8bce7c5913a96ceb78ae385c4c","revid":32552,"title":"NELECT","url":"https://www.vasp.at/wiki/NELECT","wikitext_bytes":3288,"wikitext_sha256":"693b4ef90a91ef63c1df46c9a86de6cae2d2664d0e71982473679d19653b3cf4"},{"api_request_url":"https://www.vasp.at/wiki/api.php?action=parse&oldid=27291&prop=text%7Cwikitext%7Crevid%7Cdisplaytitle&format=json&formatversion=2","pageid":39,"raw_json_bytes":19711,"raw_json_sha256":"a1982af46aa5593086bde5f0e6e39e8ebfcf1fc32b11ace50fe8c83fbe6c7496","revid":27291,"title":"LREAL","url":"https://www.vasp.at/wiki/LREAL","wikitext_bytes":6326,"wikitext_sha256":"0e9f2ab7d155cb94bb32886f4a97e57a1cd7e49f9f7f04f5201c9db4af47819a"},{"api_request_url":"https://www.vasp.at/wiki/api.php?action=parse&oldid=33504&prop=text%7Cwikitext%7Crevid%7Cdisplaytitle&format=json&formatversion=2","pageid":42,"raw_json_bytes":6358,"raw_json_sha256":"e274055e5f29810212adf062c26cd90c033cae3d1d4e8f42050500af9cdfde3d","revid":33504,"title":"AEXX","url":"https://www.vasp.at/wiki/AEXX","wikitext_bytes":1182,"wikitext_sha256":"d57991584096e082a920fd1bcad23215ae29fe5ea3f21b4fab1d10d45076a24f"},{"api_request_url":"https://www.vasp.at/wiki/api.php?action=parse&oldid=34124&prop=text%7Cwikitext%7Crevid%7Cdisplaytitle&format=json&formatversion=2","pageid":47,"raw_json_bytes":10227,"raw_json_sha256":"50fa8b5cdfaa533815f6c28e2157f11305b85ba2cfa9e350ec3ffb914b7420ca","revid":34124,"title":"LHFCALC","url":"https://www.vasp.at/wiki/LHFCALC","wikitext_bytes":2563,"wikitext_sha256":"2d66659ce6dc9558378f5386cdc78c2857f7eb18f574a1e53a87ddb07c4d4eec"},{"api_request_url":"https://www.vasp.at/wiki/api.php?action=parse&oldid=25497&prop=text%7Cwikitext%7Crevid%7Cdisplaytitle&format=json&formatversion=2","pageid":48,"raw_json_bytes":2710,"raw_json_sha256":"3b15960aa130089dca7acb6f255bc9a8833bfc2797a193900b6b64c3f46dee11","revid":25497,"title":"TIME","url"